,topic,title,date,events,id,sentence,clause,dateText,exactDate,paragraphNo,realDate,lengthDate,endDate,url
0,Chris Watts,The cold-hearted case of Chris Watts: Here are all the latest updates – Film Daily,2018-01-01 00:00:00+00:00,kill,43,"Watts, a husband and father, killed his pregnant wife, Shan'Ann, and his two daughters, Bella (4) and Celeste (3) back in 2018. ",Watts a husband and father killed pregnant wife Shan Ann and two daughters Bella 4 and Celeste 3 back in 2018,2018,FALSE,1,TRUE,365 days,2019-01-01 00:00:00+00:00,https://filmdaily.co/news/chris-watts-updates/
1,Chris Watts,Chris Watts movie: The horrific story behind the cruel murders – Film Daily,2018-01-01 00:00:00+00:00,discover,46,", it's because in 2018 it was discovered he had killed his pregnant wife and their two daughters. ",in 2018 it was discovered,2018,FALSE,2,TRUE,365 days,2019-01-01 00:00:00+00:00,https://filmdaily.co/news/chris-watts-movie-story/
2,Chris Watts,"Lifetime Has Your Saturday Nights Covered with New ‘Ripped from the Headlines’ Movies About Chris Watts Murders, More",2018-01-01 00:00:00+00:00,disappear,165,People were riveted when Shanann Watts and her two young daughters disappeared in 2018. ,Shanann Watts and two young daughters disappeared in 2018,2018,FALSE,14,TRUE,365 days,2019-01-01 00:00:00+00:00,https://www.cheatsheet.com/entertainment/lifetime-has-your-saturday-nights-covered-with-new-ripped-from-the-headlines-movies-about-chris-watts-murders-more.html/
3,Chris Watts,"Pregnant woman, 2 daughters reported missing in Frederick",2018-08-13 00:00:00+00:00,arrest,10,"Christopher Watts, the husband of a pregnant Frederick woman who has been missing along with his two young daughters since Monday has been arrested. ",Monday has been arrested,Monday,FALSE,4,TRUE,7 days,2018-08-20 00:00:00+00:00,https://kdvr.com/news/local/pregnant-woman-2-daughters-reported-missing-in-frederick/
4,Chris Watts,Coroner positively identifies the bodies of Shanann Watts and her two daughters,2018-08-13 00:00:00+00:00,identify,184,"FREDERICK, Colo. — The Weld County Coroner's Office confirmed late Friday afternoon that they have positively identified the three bodies recovered earlier this week as Shanann Watts, a pregnant mother from Frederick, and her two young daughters.",they have positively identified the three bodies recovered earlier this week as Shanann Watts a pregnant mother from Frederick and two young daughters,earlier this week,FALSE,2,TRUE,7 days,2018-08-20 00:00:00+00:00,https://www.9news.com/article/news/crime/body-recovered-that-is-quite-certain-to-be-shanann-watts-search-for-girls-bodies-continue/73-584555753
5,Chris Watts,"Pregnant woman, 2 daughters reported missing in Frederick",2018-08-14 00:00:00+00:00,see,9,Please look at the time stamp on the story to see when it was last updated.,to see when,0,FALSE,0,FALSE,,,https://kdvr.com/news/local/pregnant-woman-2-daughters-reported-missing-in-frederick/
6,Chris Watts,"Pregnant woman, 2 daughters reported missing in Frederick",2018-08-14 00:00:00+00:00,confirm,12,Police confirm the behavior is out of character and that's why they're concerned. ,Police confirm,0,FALSE,34,FALSE,,,https://kdvr.com/news/local/pregnant-woman-2-daughters-reported-missing-in-frederick/
7,Chris Watts,"Pregnant woman, 2 daughters reported missing in Frederick",2018-08-14 00:00:00+00:00,search,13,They searched the neighborhood with K-9s and officers most of the day.,They searched the neighborhood with K 9s and officers most of the day,the day,FALSE,34,TRUE,7 days,2018-08-21 00:00:00+00:00,https://kdvr.com/news/local/pregnant-woman-2-daughters-reported-missing-in-frederick/
8,Chris Watts,"Pregnant woman, 2 daughters reported missing in Frederick",2018-08-14 00:00:00+00:00,ask,14,Anyone with information is asked to call police at 303-652-4222 or email.,Anyone with information is asked,0,FALSE,44,FALSE,,,https://kdvr.com/news/local/pregnant-woman-2-daughters-reported-missing-in-frederick/
9,Chris Watts,"Pregnant woman, 2 daughters reported missing in Frederick",2018-08-14 00:00:00+00:00,call,15,Anyone with information is asked to call police at 303-652-4222 or email.,to call police at or email,0,FALSE,44,FALSE,,,https://kdvr.com/news/local/pregnant-woman-2-daughters-reported-missing-in-frederick/
10,Chris Watts,"Frederick man reportedly held without bond facing murder charges over missing wife, daughters’ deaths",2018-08-15 00:00:00+00:00,find,131,"According to The Denver Channel, Watts last night confessed to killing the three, and investigators believe they know where to find the bodies.",to find the bodies,0,FALSE,4,FALSE,,,https://www.denverpost.com/2018/08/15/husband-of-pregnant-frederick-woman-detained/
11,Chris Watts,Frederick police ask for public’s help in search for missing pregnant woman and her two daughters,2018-08-15 00:00:00+00:00,release,133,"Officials did not release any new information Wednesday afternoon because they didn't want to jeopardize the ongoing investigation, Frederick police spokesman Sgt. ",Officials did not release any new information Wednesday afternoon because,0,FALSE,2,FALSE,,,https://www.denverpost.com/2018/08/15/frederick-missing-pregnant-mom-update/
12,Chris Watts,Frederick police ask for public’s help in search for missing pregnant woman and her two daughters,2018-08-15 00:00:00+00:00,vanish,137,Vanished. ,Vanished,0,FALSE,14,FALSE,,,https://www.denverpost.com/2018/08/15/frederick-missing-pregnant-mom-update/
13,Chris Watts,"FBI, CBI join search for pregnant mom, 2 daughters last seen in Frederick",2018-08-15 00:00:00+00:00,involve,180,"The FBI and Colorado Bureau of Investigation are now involved in the search for a pregnant woman and her two young daughters last seen in Frederick, according to a Wednesday morning update from Frederick Police Department.",The FBI and Colorado Bureau of Investigation are now involved in the search for a pregnant woman and two young daughters last seen in Frederick according to a Wednesday morning update from Frederick Police Department,now,FALSE,0,TRUE,7 days,2018-08-22 00:00:00+00:00,https://www.denverpost.com/2018/08/15/frederick-missing-woman-daughters-2/
14,Chris Watts,"Frederick man suspected of killing wife, two young daughters had climbed from deep financial troubles to apparent prosperity",2018-08-16 00:00:00+00:00,accuse,1,"So the news that Christopher is being accused of killing Shanann and their two daughters, 3-year-old Celeste and 4-year-old Bella, makes no sense to family members and friends who knew them.",Christopher is being accused of,0,FALSE,8,FALSE,,,https://www.denverpost.com/2018/08/16/who-is-christopher-watts-frederick-murders/
15,Chris Watts,"Frederick man suspected of killing wife, two young daughters had climbed from deep financial troubles to apparent prosperity",2018-08-16 00:00:00+00:00,appear,4,The Wattses appeared to be going through a rocky period when they moved from North Carolina to Colorado in 2012. ,The Wattses appeared,0,FALSE,47,FALSE,,,https://www.denverpost.com/2018/08/16/who-is-christopher-watts-frederick-murders/
16,Chris Watts,"Frederick man suspected of killing wife, two young daughters had climbed from deep financial troubles to apparent prosperity",2018-08-16 00:00:00+00:00,look,7,"Joshua Polson, The Greeley Tribune via AP Christopher Watts looks down during his bond hearing at the Weld County Courthouse Thursday, Aug. 16, 2018, in Greeley, Colo.",looks down during bond hearing at the Weld County Courthouse Thursday,Thursday,FALSE,63,TRUE,7 days,2018-08-23 00:00:00+00:00,https://www.denverpost.com/2018/08/16/who-is-christopher-watts-frederick-murders/
17,Chris Watts,Financial issues plagued Chris and Shanann Watts 3 years before alleged killings,2018-08-16 00:00:00+00:00,help,195,"We are sharing any information that may help neighbors, friends and the public understand the stresses that may have contributed to this tragedy.",may help,0,FALSE,2,FALSE,,,https://www.9news.com/article/news/local/investigations/financial-issues-plagued-chris-and-shanann-watts-3-years-before-alleged-killings/584822605
18,Chris Watts,"Bodies suspected of being missing Colorado mom, 2 kids found; husband arrested",2018-08-17 00:00:00+00:00,suspect,227,"Investigators in Colorado have found three bodies they suspect are those of a pregnant wife and her two young daughters, a day after authorities arrested the woman's husband on suspicion of three counts of murder.",they suspect,0,FALSE,2,FALSE,,,https://www.nbcnews.com/news/us-news/husband-arrested-connection-missing-colorado-woman-their-two-kids-n901146
19,Chris Watts,"Christopher Watts pleads guilty to killing wife, children — will be spared death penalty",2018-11-07 00:00:00+00:00,claim,207,"Christopher Watts initially claimed to police after he was arrested that he killed Shanann Watts after she killed their daughters, according to court documents.",Christopher Watts initially claimed to police after,0,FALSE,24,FALSE,,,https://www.nbcnews.com/news/us-news/christopher-watts-pleads-guilty-killing-wife-children-will-be-spared-n932451
20,Chris Watts,"'He's not a monster': Parents of Chris Watts defend son who admitted to killing wife, children",2018-11-14 00:00:00+00:00,happen,219,but if something happened that night and that did happen -- God forbid if it did happen ,something happened that night,0,FALSE,6,FALSE,,,https://abc11.com/not-a-monster-chris-watts-parents-defend-son-who-murdered-family/4677948/
21,Chris Watts,Christopher Watts sentenced to life in prison for killing his pregnant wife and young daughters,2018-11-19 00:00:00+00:00,sentence,173,"Following the statements, the judge sentenced Watts to three consecutive sentences of life in prison with no possibility for parole. ",Following the statements the judge sentenced Watts to three consecutive sentences of life in prison with no possibility for parole,0,FALSE,12,FALSE,,,https://www.nbcnews.com/news/us-news/colorado-dad-christopher-watts-sentenced-life-prison-killing-his-pregnant-n937931
22,Chris Watts,Christopher Watts sentenced to life in prison for killing his pregnant wife and young daughters,2018-11-19 00:00:00+00:00,fire,177,"Anadarko Petroleum fired Watts on Aug. 15, the day he was arrested. ",Anadarko Petroleum fired Watts on 15 the day,the day,FALSE,42,TRUE,7 days,2018-11-26 00:00:00+00:00,https://www.nbcnews.com/news/us-news/colorado-dad-christopher-watts-sentenced-life-prison-killing-his-pregnant-n937931
23,Chris Watts,Book reveals Chris Watts's letter confessing how he killed his family,2019-10-02 00:00:00+00:00,obtain,72,"Family annihilator Chris Watts has made a chilling new confession that he 'murdered his daughters twice', in a disturbing prison letter obtained exclusively by DailyMailTV.",Family annihilator Chris Watts has made a chilling new confession that in a disturbing prison letter obtained exclusively by DailyMailTV,0,FALSE,0,FALSE,,,https://www.dailymail.co.uk/news/article-7520985/Chris-Watts-chilling-letter-confessing-killed-family.html
24,Chris Watts,Book reveals Chris Watts's letter confessing how he killed his family,2019-10-02 00:00:00+00:00,attempt,73,"Watts' letter, below in its entirety, lays out in grim detail how he attempted to smother his daughters, Bella, 4, and Celeste, 3, before strangling his pregnant wife Shanann at their home in Frederick, Colorado.",he attempted,0,FALSE,2,FALSE,,,https://www.dailymail.co.uk/news/article-7520985/Chris-Watts-chilling-letter-confessing-killed-family.html
25,Chris Watts,Book reveals Chris Watts's letter confessing how he killed his family,2019-10-02 00:00:00+00:00,receive,78,He agreed to the book in exchange for Cadle's promise that she would publish his 'testimony of coming to God and the forgiveness he received',he received,0,FALSE,20,FALSE,,,https://www.dailymail.co.uk/news/article-7520985/Chris-Watts-chilling-letter-confessing-killed-family.html
26,Chris Watts,Book reveals Chris Watts's letter confessing how he killed his family,2019-10-02 00:00:00+00:00,die,89,Her eyes filled with blood; as she looked at me and she died. ,she died,0,FALSE,61,FALSE,,,https://www.dailymail.co.uk/news/article-7520985/Chris-Watts-chilling-letter-confessing-killed-family.html
27,Chris Watts,Book reveals Chris Watts's letter confessing how he killed his family,2019-10-02 00:00:00+00:00,hit,93,I heard the splash as she hit the oil.',she hit the oil,0,FALSE,93,FALSE,,,https://www.dailymail.co.uk/news/article-7520985/Chris-Watts-chilling-letter-confessing-killed-family.html
28,Chris Watts,"Lifetime Has Your Saturday Nights Covered with New ‘Ripped from the Headlines’ Movies About Chris Watts Murders, More",2019-12-01 00:00:00+00:00,attack,169,"When law student Amy Thompson (Lyndsy Fonseca) is attacked by a friend of a friend named Demetri (Hunter Burke), she becomes pregnant. ",law student Amy Thompson Lyndsy Fonseca is attacked by a friend of a friend named Demetri Hunter Burke,0,FALSE,32,FALSE,,,https://www.cheatsheet.com/entertainment/lifetime-has-your-saturday-nights-covered-with-new-ripped-from-the-headlines-movies-about-chris-watts-murders-more.html/
29,Chris Watts,‘Chris Watts: Confessions of a Killer’: Why Is the Watts Family Angry About the Lifetime Movie?,2020-01-28 00:00:00+00:00,charge,22,34-year-old Watts admitted to the murders and was charged with multiple counts of first-degree murder. ,34 year old Watts admitted to the murders and was charged with multiple counts of first degree murder,0,FALSE,6,FALSE,,,https://www.cheatsheet.com/entertainment/chris-watts-confessions-of-a-killer-why-is-the-watts-family-angry-about-the-lifetime-movie.html/
30,Chris Watts,Why did murderer Chris Watts kill his pregnant wife? – Film Daily,2020-03-26 00:00:00+00:00,miss,110,"Shanann had missed an OB-GYN appointment, failed to return text messages, and missed a meeting that day, all behaviors that were grossly out of character for the bubbly young mom.",Shanann had missed an OB GYN appointment failed and missed a meeting that day all behaviors that of character for the bubbly young mom,0,FALSE,8,FALSE,,,https://filmdaily.co/news/chris-watts/
31,Chris Watts,'Confessions of a Killer': All the tea regarding the Chris Watts movie – Film Daily,2020-05-14 00:00:00+00:00,act,35,"Not only do the characters dress and act just like the real-life people, Confessions of a Killer captures their lifestyle. ",Not only do the characters dress and act just like the real life people,0,FALSE,19,FALSE,,,https://filmdaily.co/news/chris-watts-movie/
32,Chris Watts,What drove Chris Watts to murder? Every documentary on the subject – Film Daily,2020-07-27 00:00:00+00:00,assault,144,Chris Watts could end up assaulted or worse if he's alone with another inmate or put in gen pop.,Chris Watts could end up assaulted or worse if pop,0,FALSE,30,FALSE,,,https://filmdaily.co/obsessions/true-crime/chris-watts-documentary/
